Date,Ticker,Headline,Source,Next_Day_Return,Label
2025-12-15,GOOGL,"Alphabet's AI Chops Caught Up, But The Stock Needs A Reset (NASDAQ:GOOG) (NASDAQ:GOOGL) - Seeking Alpha",Seeking Alpha,-0.005353299234149622,DOWN
2025-10-16,GOOGL,"Google, IBD Stock Of The Day, Closing In On AI Winner's Circle - Investor's Business Daily",Investor's Business Daily,0.007317302723738317,UP
2025-10-09,GOOGL,Google's stock is up 70%: Can the rally last? - Yahoo Finance,Yahoo Finance,-0.020535746515027986,DOWN
2025-10-21,GOOGL,GOOGL Stock On Fire: Up 8% With 6-Day Winning Streak - Forbes,Forbes,0.004910988972602448,NEUTRAL
2025-11-27,GOOGL,"GOOGL News Today, Nov 27: AI Innovations Propel Google’s Stock Surge - Meyka",Meyka,-0.01652191744239284,DOWN
2025-10-22,GOOGL,"Google Stock Climbs Amid Anthropic Cloud Talks, Quantum Advances - Investor's Business Daily",Investor's Business Daily,0.00552263671369535,UP
2025-11-10,GOOGL,Think It's Too Late to Buy Alphabet (Google) Stock? Here's the 1 Reason Why There's Still Time. - The Motley Fool,The Motley Fool,0.004170937378253692,NEUTRAL
2025-10-27,GOOGL,Should You Buy Alphabet Stock Before Oct. 29? - The Motley Fool,The Motley Fool,-0.006684644958969366,DOWN
2025-11-29,GOOGL,Is This the Undiscussed Reason Buffett Just Bought Alphabet (Google) Stock? - The Motley Fool,The Motley Fool,0.002921572280305318,NEUTRAL
2025-11-24,GOOGL,"Alphabet Stock: The ""Missed AI"" Narrative Is Officially Dead (NASDAQ:GOOG) - Seeking Alpha",Seeking Alpha,0.015255255140113944,UP
2025-12-01,GOOGL,Trillion-Dollar Companies Now Go To 11; Google Is No. 3 - Investor's Business Daily,Investor's Business Daily,0.002921572280305318,NEUTRAL
2025-10-21,GOOGL,Alphabet (GOOGL) Stock Moves -2.37%: What You Should Know - Yahoo Finance,Yahoo Finance,0.004910988972602448,NEUTRAL
2025-11-04,GOOGL,This One Number Will Take Google Stock Higher - The Motley Fool,The Motley Fool,0.02439284166801814,UP
2025-12-02,GOOGL,"Google’s lawsuit, Kalshi’s latest valuation, Eventbrite’s exit: Stock Market News - thestreet.com",thestreet.com,0.012095983860288984,UP
2025-10-17,GOOGL,Alphabet VP O’Toole sells $694k in GOOGL stock - Investing.com,Investing.com,0.012830588752420269,UP
2025-11-14,GOOGL,Warren Buffett's Berkshire Hathaway reveals new $4.3 billion Alphabet (GOOGL) stock holding - Shacknews,Shacknews,0.031149374212974257,UP
2025-11-13,GOOGL,Why Alphabet Stock Is Sinking Today - The Motley Fool,The Motley Fool,-0.007753928185205039,DOWN
2025-11-22,GOOGL,"GOOG Stock Price Prediction: Where Alphabet Could Be by 2025, 2026, and 2030 - Yahoo Finance",Yahoo Finance,0.015255255140113944,UP
2025-12-08,GOOGL,Can Google Stock Hit $400 in 2026? - Barchart.com,Barchart.com,0.010710140693894532,UP
2025-12-07,GOOGL,"Here's Why Alphabet Is the Best-Performing ""Magnificent Seven"" Stock in 2025 (and Why It Has Room to Run in 2026) - The Motley Fool",The Motley Fool,0.010710140693894532,UP
2025-12-26,GOOGL,ADBE vs. GOOGL: Which AI-Driven Tech Stock Has an Edge Now? - Zacks Investment Research,Zacks Investment Research,0.00015944560432412658,NEUTRAL
2025-11-24,GOOGL,Why Is Alphabet (GOOGL) Stock Jumping Today? - TradingView — Track All Markets,TradingView — Track All Markets,0.015255255140113944,UP
2025-10-20,GOOGL,This Wall Street Firm Says Alphabet Stock Is A Better Bet Than Meta. Here's Why. - Investopedia,Investopedia,-0.02373804253829992,DOWN
2025-11-25,GOOGL,"GOOGL News Today, Nov 25: Google Stock Rises Amidst AI and Cloud Focus - Meyka",Meyka,-0.010790201324564874,DOWN
2025-09-27,GOOGL,Alphabet (GOOGL) Stock Reiterated Neutral After Gemini Chrome Integration - Yahoo Finance,Yahoo Finance,-0.0038926134690757674,NEUTRAL
2025-09-23,GOOGL,Is Google Stock a Buy at New All-Time Highs? - Barchart.com,Barchart.com,-0.017960735247747994,DOWN
2025-11-01,GOOGL,Alphabet Stock: Rally Catches Up To Reality (NASDAQ:GOOG) - Seeking Alpha,Seeking Alpha,-0.021782052468770408,DOWN
2025-11-24,GOOGL,"S&P 500 rips 1.6% higher, Nasdaq posts best day since May as Alphabet reignites AI trade - CNBC",CNBC,0.015255255140113944,UP
2025-11-21,GOOGL,Amazon And Google's 'OpenAI Dilemma' Sparks Debate On Wall Street After AI Cloud Deals - Investor's Business Daily,Investor's Business Daily,0.06313819444727531,UP
2025-10-27,GOOGL,"Google: Too Far, Too Fast (NASDAQ:GOOGL) - Seeking Alpha",Seeking Alpha,-0.006684644958969366,DOWN
2025-10-24,GOOGL,"Buy, Sell or Hold GOOGL Stock Before Q3 Earnings? Here's What to Know - Zacks Investment Research",Zacks Investment Research,0.03597242410613788,UP
2025-10-09,GOOGL,Google Launches Gemini Enterprise As Tech Giants Race To Offer AI Agents - Investor's Business Daily,Investor's Business Daily,-0.020535746515027986,DOWN
2025-11-26,GOOGL,"GOOGL Stock News Today, Nov 26: Google Stock Surges Amid AI and Cloud - Meyka",Meyka,0.0007187941819570831,NEUTRAL
2025-12-03,GOOGL,Cathie Wood Is Buying Up Google Stock at Record Highs. Should You? - Barchart.com,Barchart.com,-0.0062885564724237675,DOWN
2025-12-02,GOOGL,Alphabet VP O’Toole sells $302k in GOOGL stock - Investing.com,Investing.com,0.012095983860288984,UP
2025-11-20,GOOGL,Alphabet's record-high stock rally continues amid AI enthusiasm; unveils $2B data center (GOOG:NASDAQ) - Seeking Alpha,Seeking Alpha,0.03527373218836982,UP
2025-09-25,GOOGL,"Google Shakes Up Cryptocurrency, Digital Payments With AI Agents Protocol - Investor's Business Daily",Investor's Business Daily,0.0030513935556579774,NEUTRAL
2025-11-24,GOOGL,Google Stock Is No Longer Cheap as Alphabet’s Gemini 3 Is ‘Kind of a Wow’ - TipRanks,TipRanks,0.015255255140113944,UP
2025-10-20,GOOGL,3 Reasons Why You Should Buy Alphabet Stock Before Oct. 29 - The Motley Fool,The Motley Fool,-0.02373804253829992,DOWN
2025-11-19,GOOGL,"Google Stock Hits $300 For First Time Ever After Announcing Gemini 3, Waymo Expansion - Stocktwits",Stocktwits,-0.011474964973761326,DOWN
2025-12-01,GOOGL,"As Google Locks Down a Multimillion-Dollar NATO Deal, Should You Buy, Sell, or Hold GOOGL Stock? - Barchart.com",Barchart.com,0.002921572280305318,NEUTRAL
2025-11-19,GOOGL,Alphabet (GOOGL) stock jumps over 6% to hit $300 for the first time in history as Gemini 3 powers Alphabet - The Economic Times,The Economic Times,-0.011474964973761326,DOWN
2025-12-02,META,Meta Platforms (META) Increased Its Capex Estimation in 2026. Here’s Why - Yahoo Finance,Yahoo Finance,-0.01159018510124088,DOWN
2025-12-23,META,Meta Stock Price Target Trimmed By Analyst. Can 'Wounded Sentiment' Recover In 2026? - Investor's Business Daily,Investor's Business Daily,0.003925144136282421,NEUTRAL
2025-11-09,META,Huge News for Meta Stock Investors - Nasdaq,Nasdaq,-0.007407814938252266,DOWN
2025-11-09,META,Huge News for Meta Stock Investors - The Motley Fool,The Motley Fool,-0.007407814938252266,DOWN
2025-12-01,META,"Why Meta’s stock may be ready to rally 70%, despite Zuckerberg’s massive AI-spending plans - MarketWatch",MarketWatch,0.009721147405932218,UP
2025-10-30,META,"Meta stock has worst day in 3 years, dropping 11% on higher AI spend - CNBC",CNBC,-0.027188006906345485,DOWN
2025-12-14,META,"Meta (META) Stock Pops Following Metaverse Cuts Announcement – Could it Hit $1,000 In 2026? - Yahoo Finance",Yahoo Finance,0.014887823358787688,UP
2025-12-30,META,Meta Stock Rises On Manus AI Acquisition. Deal Seen As Having 'Transformative' Potential. - Investor's Business Daily,Investor's Business Daily,,NEUTRAL
2025-12-04,META,Meta stock climbs 3% on report of planned metaverse cuts - CNBC,CNBC,0.017973390893688768,UP
2025-12-02,META,Is Meta Stock a Buy After Its AI Spending Spree? - Yahoo Finance,Yahoo Finance,-0.01159018510124088,DOWN
2025-12-18,META,Meta Stock Tests Key Level. Analyst Sees Chance For Facebook Parent To Shake AI Worries. - Investor's Business Daily,Investor's Business Daily,-0.008548412328136856,DOWN
2025-12-30,META,"Street analyst reveals 3 AI stocks set to dominate 2026 – plus, Meta’s next move - CNBC",CNBC,,NEUTRAL
2025-11-05,META,"Meta Stock Dips as AI Spending Hits Margins, Triggers Short-Term Selloff - Yahoo Finance",Yahoo Finance,-0.02674741141844028,DOWN
2025-10-30,META,Meta stock plunges more than 10% as analysts cut price targets on sky-high AI spending - Yahoo Finance,Yahoo Finance,-0.027188006906345485,DOWN
2025-12-01,META,Is Meta Platforms Stock a Buy Below $650? - Yahoo Finance,Yahoo Finance,0.009721147405932218,UP
2025-12-04,META,ChatGPT Thinks Meta Stock Price Will Close At This Level By The End of 2025 - Yahoo Finance,Yahoo Finance,0.017973390893688768,UP
2025-10-06,META,Is Meta Stock a Buy or a Sell as ‘AI Bubble’ Chatter Grows? - Yahoo Finance,Yahoo Finance,-0.003605040638220869,NEUTRAL
2025-10-30,META,Meta Stock Plummets as Investors Horrified at How Much Zuckerberg Is Spending on Misfired AI - Yahoo Finance,Yahoo Finance,-0.027188006906345485,DOWN
2025-11-28,META,Jim Cramer Says “Meta’s Been Quiet” - Yahoo Finance,Yahoo Finance,-0.010926844959189719,DOWN
2025-11-19,META,Is Meta Stock a Buy or a Sell Before Michael Burry Drops His Bombshell on November 25? - Yahoo Finance,Yahoo Finance,-0.001981907757730994,NEUTRAL
2025-10-31,META,Opinion: Meta Stock’s Post-Earnings Plunge is a Golden Opportunity to Buy - Yahoo Finance,Yahoo Finance,-0.016410823155651455,DOWN
2025-12-28,META,The Next Stock-Split Stock That Could Make You Rich - The Motley Fool,The Motley Fool,0.011021891540354378,UP
2025-10-21,META,Meta Stock Took A Hit After Red-Hot Run. Why These Analysts Remain Bullish. - Investor's Business Daily,Investor's Business Daily,0.00019085136369167977,NEUTRAL
2025-11-06,META,Why Meta Platforms Stock Fell 12% in October - Yahoo Finance,Yahoo Finance,0.004475423463764727,NEUTRAL
2025-12-17,META,Is Meta Stock Primed for a Comeback in 2026? - The Motley Fool,The Motley Fool,0.02301772472214214,UP
2025-11-03,META,Meta Stock Up 8% — Why Zuckerberg’s Innovation Drought May Sink $META - Forbes,Forbes,-0.016292763211145256,DOWN
2025-12-04,META,Meta stock surges after Zuckerberg plans deep cuts to metaverse efforts - Investing.com,Investing.com,0.017973390893688768,UP
2025-11-04,META,Evercore ISI Reduces PT on Meta Platforms (META) Stock - Yahoo Finance,Yahoo Finance,0.013756964098529334,UP
2025-11-03,META,"Meta's Stock Dropped, but Its AI Strategy May Be Stronger Than Ever - Yahoo Finance",Yahoo Finance,-0.016292763211145256,DOWN
2025-12-04,META,"Meta (META) Stock Is Up, What You Need To Know - Yahoo Finance",Yahoo Finance,0.017973390893688768,UP
2025-12-04,META,Meta Stock Jumps On Report That Zuckerberg Wants 'Deep Cuts' For Metaverse Budget - Investor's Business Daily,Investor's Business Daily,0.017973390893688768,UP
2025-12-17,META,"Meta’s stock could soar in the next 6 months, along with these under-the-radar picks - MarketWatch",MarketWatch,0.02301772472214214,UP
2025-11-30,META,Meta stock: 3 important things investors need to know before buying - Yahoo Finance UK,Yahoo Finance UK,0.009721147405932218,UP
2025-12-04,META,Meta Faces EU Antitrust Probe Over WhatsApp AI Policies It Says Blocks Rival Apps - Investor's Business Daily,Investor's Business Daily,0.017973390893688768,UP
2025-10-30,META,S&P 500 Gains and Losses Today: Meta Stock Drops After Earnings; Moderna Surges - Investopedia,Investopedia,-0.027188006906345485,DOWN
2025-10-11,META,"META Stock Target Raised to $900 by Citizens, Citing Strong AI-Driven Growth - Yahoo Finance",Yahoo Finance,-0.009850489989606914,DOWN
2025-11-05,META,Should You Buy Meta Platforms Stock on the Dip? - Yahoo Finance,Yahoo Finance,-0.02674741141844028,DOWN
2025-02-14,META,Meta stock continues record run: 'Prime example' of implementing AI - Yahoo Finance,Yahoo Finance,-0.027556378126012637,DOWN
2025-10-27,META,Should You Buy Meta Stock Before the Big Investor Update? - The Motley Fool,The Motley Fool,0.0008257799552695566,NEUTRAL
2025-12-05,META,Wall Street loves Meta’s reported metaverse cuts. Most analysts see 20%-plus gain for stock - CNBC,CNBC,-0.009830445808821642,DOWN
2025-11-06,META,Massive News for Meta Platforms Stock Investors - The Motley Fool,The Motley Fool,0.004475423463764727,NEUTRAL
2025-11-03,META,Is Meta a Bargain After This Month’s 8.8% Drop and AI Expansion News? - Yahoo Finance,Yahoo Finance,-0.016292763211145256,DOWN
2025-12-14,META,1 Reason I Will Never Sell Meta Platforms Stock - The Motley Fool,The Motley Fool,0.014887823358787688,UP
2025-10-30,META,Why Meta Stock Is Down Big Today - The Motley Fool,The Motley Fool,-0.027188006906345485,DOWN
2025-10-29,META,Meta stock falls on earnings: 2 reasons investors are spooked - Yahoo Finance,Yahoo Finance,-0.11334759545156259,DOWN
2025-12-26,META,"Meta Platforms Stock (NASDAQ: META) Today: Price, Latest News, Analyst Forecasts, and What to Watch After the Close - ts2.tech",ts2.tech,-0.0069350898375067915,DOWN
2025-12-29,META,Three Catalysts That Can Rally META Stock - Forbes,Forbes,0.011021891540354378,UP
2025-12-25,META,Meta Platforms (NASDAQ: META) Stock Price Prediction for 2026: Where Will It Be in 1 Year (Dec 25) - Yahoo Finance,Yahoo Finance,-0.0069350898375067915,DOWN
2025-11-19,META,Meta Stock Slide Deepens. Here's Another AI Cost To Watch. - Investor's Business Daily,Investor's Business Daily,-0.001981907757730994,NEUTRAL
2025-10-29,META,Here's How Much Traders Expect Meta Stock To Move After Earnings This Week - Investopedia,Investopedia,-0.11334759545156259,DOWN
2025-12-11,META,Meta In 2026: Can Zuckerberg Win Back Wall Street? - Investor's Business Daily,Investor's Business Daily,-0.012991977940506216,DOWN
2025-11-27,META,History Says Now Is the Perfect Time to Buy Meta Stock - Yahoo Finance,Yahoo Finance,-0.010926844959189719,DOWN
2025-11-28,META,How Meta Stock Can Surge? - Forbes,Forbes,-0.010926844959189719,DOWN
2025-12-12,META,Will Meta Stock Rebound From $650? - Forbes,Forbes,0.005911081279098118,UP
2025-12-29,META,"Ranking the Best ""Magnificent Seven"" Stocks to Buy for 2026. Here's My No. 3 - The Motley Fool",The Motley Fool,0.011021891540354378,UP
2025-11-03,META,"Meta's Stock Dropped, but Its AI Strategy May Be Stronger Than Ever - The Motley Fool",The Motley Fool,-0.016292763211145256,DOWN
2025-11-24,META,"Meta (META) Stock Trades Up, Here Is Why - TradingView — Track All Markets",TradingView — Track All Markets,0.03779454138520566,UP
2025-12-30,META,Meta Stock Rises After Buying Manus. What the China-Founded AI Start-Up Brings. - Barron's,Barron's,,NEUTRAL
2025-11-11,META,Why Is Wall Street So Bearish on Meta? There's 1 Key Reason. - The Motley Fool,The Motley Fool,-0.028816135118604147,DOWN
2025-10-29,META,Meta Platforms stock sinks after booking $16B one-time charge in Q3 (META:NASDAQ) - Seeking Alpha,Seeking Alpha,-0.11334759545156259,DOWN
2025-12-28,META,Meta stock ends lower as New York warning-label law and teen-user leak renew scrutiny - ts2.tech,ts2.tech,0.011021891540354378,UP
2025-10-29,META,Meta Stock On Winning Streak With Earnings Due. This Number Takes 'Center Stage.' - Investor's Business Daily,Investor's Business Daily,-0.11334759545156259,DOWN
2025-11-07,META,Meta Stock Falls Again As Social Media Giant Replaces Amazon As Magnificent Seven Laggard - Investor's Business Daily,Investor's Business Daily,0.016165091145470045,UP
2025-10-08,META,Meta Platforms Stock Investors: Circle This Date on Your Calendar - The Motley Fool,The Motley Fool,0.021829285384419306,UP
2025-11-03,META,Should You Buy Meta Stock While It's Under $700? - The Motley Fool,The Motley Fool,-0.016292763211145256,DOWN
2025-11-18,META,"Meta Wins FTC's Instagram, WhatsApp Antitrust Trial. Meta Stock Slump Drags On. - Investor's Business Daily",Investor's Business Daily,-0.012330839577772035,DOWN
2025-11-14,META,Meta Stock Has Taken a Massive Hit. Time to Buy? - The Motley Fool,The Motley Fool,-0.012224002270764589,DOWN
2025-07-24,META,Meta Stock Takes A Breathtaking Leap. What's In Mark Zuckerberg's Facebook AI Vision? - Investor's Business Daily,Investor's Business Daily,-0.002965747966922061,NEUTRAL
2025-12-08,META,Meta Platforms Stock Jumps on Metaverse Spending Cuts. Here's Why the Growth Stock Is a Screaming Buy Before 2026 - The Motley Fool,The Motley Fool,-0.014756940945486408,DOWN
2025-12-30,META,Meta Stock Is Climbing -- Big Bet on AI Agents with $2 Billion Acquisition - Yahoo Finance,Yahoo Finance,,NEUTRAL
2025-12-11,META,Meta stock price target reiterated at $900 by Citizens on Instagram growth - Investing.com,Investing.com,-0.012991977940506216,DOWN
2025-10-24,META,Interesting News for Meta Platforms Stock Investors - The Motley Fool,The Motley Fool,0.016875213858493776,UP
2025-12-27,META,"Meta Stock (META) Weekend Update: New Regulation Headlines, Instagram Teen Focus, and AI Spending Debate Ahead of Monday’s Open - ts2.tech",ts2.tech,0.011021891540354378,UP
2025-10-10,META,Meta stock rises as Citizens reiterates Market Outperform rating - Investing.com,Investing.com,0.01474552100090265,UP
2025-10-07,META,Meta (META) Rebounds After Europe Legal Shock -- What's Next for Investors - Yahoo Finance,Yahoo Finance,0.006675328960725091,UP
2025-12-12,META,"Meta (META) Stock News Today: Analyst Targets, AI Spending Debate and 2026 Outlook (Dec. 12, 2025) - ts2.tech",ts2.tech,0.005911081279098118,UP
2025-11-13,META,Meta Stock Is a ‘Best Idea’ After Slump. Why It Can Gain 50%. - Barron's,Barron's,-0.0007050072138292673,NEUTRAL
2025-11-18,META,Meta’s stock has been under heavy pressure. Now the company is undergoing a shakeup. - MarketWatch,MarketWatch,-0.012330839577772035,DOWN
2025-11-12,META,"Down 17% in days, this top S&P 500 stock now looks on sale to me - Yahoo Finance UK",Yahoo Finance UK,0.0014449508916298814,NEUTRAL
2025-12-15,META,META Down 19% From 52-Week High: What Awaits the Stock in 2026? - Yahoo Finance,Yahoo Finance,0.014887823358787688,UP
2025-10-21,META,Meta stock price target maintained at $900 by BofA on strong ad outlook - Investing.com,Investing.com,0.00019085136369167977,NEUTRAL
2025-11-11,META,Meta stock falls on news AI chief scientist plans exit - Investing.com,Investing.com,-0.028816135118604147,DOWN
2025-11-25,META,Meta Is Reportedly Exploring a Massive AI Chip Deal. Is This Good News for Its Stock? - The Motley Fool,The Motley Fool,-0.0041023172278793485,NEUTRAL
2025-11-29,META,$META stock rose 9% this week. Here's what we see in our data. - Quiver Quantitative,Quiver Quantitative,0.009721147405932218,UP
2025-11-05,META,"1 Incredible Reason to Buy Stock in Mark Zuckerberg's Company, Meta Platforms (META), in November - The Motley Fool",The Motley Fool,-0.02674741141844028,DOWN
2025-12-29,META,Meta stock slips as year-end tech selling hits megacaps — what investors are watching next - ts2.tech,ts2.tech,0.011021891540354378,UP
2025-11-08,META,My Advice? Don't Get Distracted By Meta Platforms Stock's Latest Slump - The Motley Fool,The Motley Fool,-0.007407814938252266,DOWN
2025-11-10,META,Meta CEO Mark Zuckerberg Just Delivered Fantastic News for Nvidia Investors - The Motley Fool,The Motley Fool,-0.007407814938252266,DOWN
2025-11-03,META,"Amazon Stock Rises, Meta Falls: Q3 Earnings Show Split Paths in AI and Clean Energy - CarbonCredits.com",CarbonCredits.com,-0.016292763211145256,DOWN
2025-10-30,META,'We expect to invest aggressively': Meta stock tumbles as tax hit and AI spending spree rattle investors - Fast Company,Fast Company,-0.027188006906345485,DOWN
2025-10-30,META,BofA Securities lowers Meta stock price target to $810 from $900 - Investing.com,Investing.com,-0.027188006906345485,DOWN
2025-12-22,META,"Meta Platforms Stock (META) News Today: Price, Forecasts and Analysis as AI Spending Meets EU Privacy Pressure (Dec. 22, 2025) - ts2.tech",ts2.tech,0.005200306033871893,UP
2025-10-13,META,Meta stock price target maintained at $900 by Citizens on Instagram growth - Investing.com,Investing.com,-0.009850489989606914,DOWN
2025-11-17,META,Should You Buy the Dip on Meta Stock? - The Motley Fool,The Motley Fool,-0.007175940159674599,DOWN
2025-10-30,META,"Stock Market News, Oct. 30, 2025: Nasdaq Dragged Lower by Meta, Microsoft Earnings - The Wall Street Journal",The Wall Street Journal,-0.027188006906345485,DOWN
2025-11-05,META,Should You Buy Meta Platforms Stock on the Dip? - The Motley Fool,The Motley Fool,-0.02674741141844028,DOWN
2025-10-30,META,"Stocks close lower, with Nasdaq down 1.6% as Big Tech leaders Meta and Microsoft decline after earnings - CNBC",CNBC,-0.027188006906345485,DOWN
2025-12-02,META,Meta Shares Reels Tips for Marketers - Social Media Today,Social Media Today,-0.01159018510124088,DOWN
2025-11-14,META,Should Investors Buy Meta Stock Instead of Alphabet Stock? - The Motley Fool,The Motley Fool,-0.012224002270764589,DOWN
2025-11-04,META,Meta Platforms Shares Fall Despite Strong Revenue Growth. Is It Time to Buy the Stock on the Dip? - The Motley Fool,The Motley Fool,0.013756964098529334,UP
